{
  "kicker": "표준 파이프라인",
  "title": "질문 하나가 의사결정문이 되기까지 — 6단계",
  "steps": [
    {
      "n": "01",
      "name": "질문 접수",
      "desc": "불량 화두면 최근 VOC·이슈를 먼저 자동 환기"
    },
    {
      "n": "02",
      "name": "전문가 발굴",
      "desc": "300+ 페르소나 풀에서 의미검색 — 인원 제한 없음"
    },
    {
      "n": "03",
      "name": "정량 근거 준비",
      "desc": "DOE·적층해석 등 도구 계산값을 토론에 주입"
    },
    {
      "n": "04",
      "name": "다중 라운드 토론",
      "desc": "초기 입장 → 상호 반박 → 수렴·표결 (2~8라운드)"
    },
    {
      "n": "05",
      "name": "의장 의사결정문",
      "desc": "결정·합의 근거·반대의견·미해결 쟁점 필수 작성"
    },
    {
      "n": "06",
      "name": "기록",
      "desc": "Report Archive 보고서 + 대화 저장, 언제든 이어하기"
    }
  ],
  "footnote": {
    "pre": "모든 도구 호출은 ",
    "strong": "MCP 게이트웨이 한 곳",
    "post": "을 지납니다 — 인증·인가·감사 로그가 단일 지점에서 적용"
  },
  "frame": {
    "brand": "HWAX 협업진단 플랫폼",
    "total": "07",
    "idx": "04"
  }
}
